<?xml version="1.0" encoding="UTF-8"?>
<!DOCTYPE branches SYSTEM "branches.dtd">
<branches>
    <branch>
        <address>76 Devonshire St, Surry Hills NSW</address>
        <contact>02 9211 1234</contact>
        <opening_hours>Mon - Fri: 6:00 to 14:30, Sat-Sun: 7:00 to 15:00</opening_hours>
        <map_link>https://www.google.com/maps/place/76+Devonshire+St,+Surry+Hills+NSW</map_link>
    </branch>
    <branch>
        <address>451 Pitt St, Haymarket Sydney, NSW</address>
        <contact>02 9262 5678</contact>
        <opening_hours>Mon - Fri: 6:00 to 16:00, Sat-Sun: 7:00 to 15:00</opening_hours>
        <map_link>https://www.google.com/maps/place/451+Pitt+St,+Haymarket+Sydney,+NSW</map_link>
    </branch>
    <branch>
        <address>31 Alfred Street, Circular Quay, NSW</address>
        <contact>02 8971 9101</contact>
        <opening_hours>Mon - Fri: 6:00 to 16:00, Sat-Sun: 7:00 to 15:00</opening_hours>
        <map_link>https://www.google.com/maps/place/31+Alfred+St,+Circular+Quay,+NSW</map_link>
    </branch>
    <branch>
        <address>99 George St, Sydney, NSW</address>
        <contact>02 1234 5678</contact>
        <opening_hours>Mon - Fri: 6:00 to 16:00, Sat-Sun: 7:00 to 15:00</opening_hours>
        <map_link>https://www.google.com/maps/place/99+George+St,+Sydney,+NSW</map_link>
    </branch>
</branches>
